{
  "id": "id-abc123",
  "arn": "arn:aws:iot:us-east-1:123456789012:thing/example",
  "name": "example-resource",
  "assetModelId": "id-abc123",
  "creationDate": "example-value",
  "lastUpdateDate": "example-value",
  "status": "ACTIVE",
  "hierarchies": "example-value",
  "description": "example-value"
}